[
  {
    "id": "START",
    "speaker": "Genka Lien, le bouffon",
    "line": "*Suspendu, puis retombant en pirouette asymétrique, Genka essuie un doigt bleu-lac sur une gravure osseuse.*\nAlors. Ici, contre là-bas. Les Gardiens-Calligraphes veulent des lignes qui ne bougent pas, des légendes qui se tiennent au garde-à-vous.\nMais toi, Uresaïr, tu es une légende qui marche. Ça leur fait une bosse dans la gorge.\n\nChez les Tisseurs de Khol, on dit que tu raccommodes le temps comme on recoud une tente après la tempête. Amusant, les moines lacustres jurent que tu es un poisson qui refuse les eaux stagnantes. Et ici. Ici, on te range dans une boîte en os, avec une étiquette propre.\n\nMoi, je prends les étiquettes, je les colle sur mon manteau, et je danse jusqu'à ce qu'elles se décollent toutes seules.\nDis. Tu veux que je te raconte ta version d'ici, ou tu préfères une version d'ailleurs, pour respirer un peu ?",
    "choices": [
      {
        "text": "Raconte la version d'ici. Je veux entendre ce qu'ils se répètent quand ils croient que je ne les écoute pas.",
        "targetNode": "END",
        "respectDelta": 1
      },
      {
        "text": "Donne-moi une version d'ailleurs. Quelque chose qui ne sent pas la poussière de leurs bibliothèques.",
        "targetNode": "END",
        "influenceDelta": 1
      },
      {
        "text": "Pourquoi tu repeins ces gravures, Genka ? Tu provoques Qalamtû, ou tu cherches autre chose ?",
        "targetNode": "END",
        "traitRequirements": [
          {
            "trait": "Lucide",
            "minValue": 5
          }
        ],
        "respectDelta": 1
      }
    ]
  }
]