[
  {
    "id": "START",
    "speaker": "Voknir Esh'Maradel, le cartographe",
    "line": "Oh Théomaque, vos pas troublent l'atelier comme on dérange un calcul inachevé. Écoutez, écoutez l'écho des Plis - ils parlent en arêtes et en failles, et mes cartes... mes cartes saignent la vérité lorsque la moelle change de fréquence. J'ai trouvé un pli qui respire selon la même série que la Vieille Ville; il n'est pas un chemin, mais une suggestion de lieu. Mais je n'ouvre pas ce passage pour rien. Dites, Rebelle Immortelle, que m'offrez-vous : protection, promesse, ou un secret plus intime encore ? (l'atelier grince, des équations tracées sur ses doigts scintillent)\n",
    "choices": [
      {
        "text": "Montre-moi la carte, vite. Où mène ce pli instable, et comment éviter ses courbures mortelles ?",
        "targetNode": "END",
        "test": "Raison+Architecture:10",
        "traitRequirements": [
          {
            "trait": "Rigoureuse",
            "minValue": 5
          }
        ],
        "respectDelta": 1
      },
      {
        "text": "Tu as prélevé de la moelle, je le sais. Rends ces fragments. Aucune géométrie ne vaut la profanation d'un corps.",
        "targetNode": "END",
        "test": "Volonté+Duperie:12",
        "traitRequirements": [
          {
            "trait": "Empathique",
            "minValue": 5
          }
        ],
        "influenceDelta": -1,
        "respectDelta": -2
      },
      {
        "text": "Aide-moi à retrouver Yul. Je t'accorderai l'asile et la sécurité du Léviathan si tu me guides.",
        "targetNode": "END",
        "test": "Volonté+Diplomatie:11",
        "traitRequirements": [
          {
            "trait": "Loyal",
            "minValue": 5
          },
          {
            "trait": "Empathique",
            "minValue": 5
          }
        ],
        "influenceDelta": 2
      },
      {
        "text": "Trace ton plan sur le mur. Je négocierai en connaissance contre ton secret cartographique.",
        "targetNode": "END",
        "test": "Raison+Affaires:10",
        "traitRequirements": [
          {
            "trait": "Rigoureuse",
            "minValue": 5
          }
        ],
        "influenceDelta": 1,
        "respectDelta": 1
      },
      {
        "text": "Je me retire. Tes cartes et tes mensonges m'appartiendront quand je les réclamerai. Pars. Je chercherai seule.",
        "targetNode": "END",
        "traitRequirements": [
          {
            "trait": "Lâche",
            "minValue": 5
          }
        ],
        "influenceDelta": -2,
        "respectDelta": -3
      }
    ]
  }
]

