[
  {
    "id": "START",
    "speaker": "Voknir Esh'Maradel, le cartographe",
    "line": "*Voknir ne se lève pas tout à fait. Il se redresse comme un compas qu’on aurait forcé. Son bras à sept doigts racle la pierre, y traçant une courbe, puis une autre, comme s’il cherchait votre place exacte dans la pièce.*\n\nThéomaque. Non. Pardon. Seigneuresse. Ici, les titres se déforment comme les couloirs.\n\nJe vous ai sentie avant de vous voir. Les Plis changent de fréquence quand vous passez. Ils deviennent… plus nets. Plus cruels aussi.\n\nJe peux vous mener vers la Vieille Ville, oui. Mais je dois d’abord savoir quel genre de voyage vous réclamez : un chemin qui respecte les Textes Absolus, ou un raccourci qui les contredit. Mes cartes saignent la vérité. La vérité, parfois, tue.",
    "choices": [
      {
        "text": "Je ne veux pas d’un chemin. Je veux une compréhension. Qu’est-ce que tu appelles une “fréquence”, ici, dans l’os ?",
        "test": "Raison+Architecture:8",
        "respectDelta": 1,
        "targetNode": "NODE_START_CHOICE_0"
      },
      {
        "text": "Conduis-moi. Peu importe si tes raccourcis profanent. Je préfère la vitesse au rite.",
        "test": "Volonté+Commandement:9",
        "allowInfluenceForcing": true,
        "influenceThreshold": 2,
        "influenceDelta": 1,
        "targetNode": "NODE_START_CHOICE_1"
      },
      {
        "text": "Si tes cartes “saignent”, c’est que tu les nourris. Dis-moi avec quoi. Et qui paye, dans les Plis.",
        "test": "Perception+Investigation:10",
        "respectDelta": -1,
        "targetNode": "END"
      }
    ]
  },
  {
    "id": "NODE_START_CHOICE_1",
    "speaker": "Voknir Esh'Maradel",
    "line": "Très bien. Tu choisis la brèche plutôt que le rite.\n\nLes Plis aiment qu'on leur parle avec des prières et des cartes propres. Quand on les force, ils répondent par des échos qui n'appartiennent ni au vivant ni au mourant. Je peux plier la route — la tordre pour qu'elle coupe entre deux vérités — mais en échange, quelque chose devra rester derrière. Une partie du chemin ne sera plus qu'une cicatrice sur la géographie. Et parfois, les cicatrices bavent.\n\nJe te conduirai sans formes inutiles, sans les ornements qui apaisent les Plis. Nous gagnerons du temps. Tu gagneras la Vieille Ville plus vite. Mais sache ceci : les raccourcis prennent ce qu'ils trouvent. Noms. Rêves. Une habitude. Rien de grandiose parfois, et d'autres fois un fragment qui te revient la nuit comme un mot malheureux.\n\nEs-tu prête à accepter que la route te rende quelque chose d'autre que ce que tu es, ou veux-tu encore négocier les termes ?",
    "consequences": {
      "flag": "ShortcutOffered",
      "description": "Voknir propose un itinéraire qui viole les Textes Absolus. Emprunter ce chemin pourra corrompre les Plis, marquer le voyageur et laisser une trace permanente sur la carte et l'âme."
    },
    "choices": [
      {
        "text": "Très bien. Prends le raccourci. Je veux la Vieille Ville, vite.",
        "allowInfluenceForcing": true,
        "influenceDelta": 1,
        "respectDelta": -1,
        "targetNode": "NODE_START_CHOICE_1_CHOICE_0"
      },
      {
        "text": "Explique-moi exactement quels risques j'encours.",
        "test": "Raison+Rhétorique:10",
        "influenceDelta": 0,
        "respectDelta": 0,
        "targetNode": "END"
      },
      {
        "text": "Non. Je tiens aux Textes. Emmène-moi par le chemin rituel.",
        "influenceDelta": -1,
        "respectDelta": 2,
        "targetNode": "END"
      },
      {
        "text": "À quel prix ? Tes raccourcis se payent.",
        "test": "Fortune+Crédit:8",
        "influenceDelta": 0,
        "respectDelta": 0,
        "targetNode": "END"
      }
    ]
  },
  {
    "id": "NODE_START_CHOICE_1_CHOICE_0",
    "speaker": "Voknir Esh'Maradel",
    "line": "Très bien. Tu choisis la brèche. Bonne ou mauvaise, elle est plus vite prise que la longue prière.\n\nÉcoute : quand je plie la route, je ne lisse pas seulement la distance — je sépare. La matière entre deux vérités se rompt et quelque chose reste entre les fibres comme une pierre coincée. Ce que tu perds n'est pas toujours grandiose : un prénom que tu n'utilises plus, la musique d'une berceuse, la façon dont ta main se pose sur la poignée. Parfois c'est une phrase entière qui te revient mal prononcée. Parfois c'est un visage qui devient flou.\n\nJe peux tenter de protéger les grands traits — le nom de ta mère, le serment que tu portes — mais cela demande de l'art et un prix ailleurs. Avant que je torde la route, veux-tu simplement t'en remettre à moi et traverser, ou soumettre le choix du prix ?",
    "consequences": {
      "flag": "AcceptedBreach",
      "description": "Le joueur a accepté le raccourci par les Plis. Un souvenir, un nom, ou une petite habitude sera perdu(e). Le MJ déterminera la nature exacte du sacrifice."
    },
    "choices": [
      {
        "text": "Fais-le maintenant. J'endure la perte.",
        "test": "Courage+Endurance:6",
        "allowInfluenceForcing": true,
        "influenceDelta": 1,
        "respectDelta": 2,
        "targetNode": "END"
      },
      {
        "text": "Réduis le coût — prends seulement une habitude insignifiante.",
        "test": "Volonté+Persuasion:12",
        "allowInfluenceForcing": true,
        "influenceDelta": 0,
        "respectDelta": -1,
        "targetNode": "END"
      },
      {
        "text": "Si quelque chose doit partir, laisse-moi choisir quel souvenir. Je veux en décider.",
        "test": "Mémoire+Occultisme:10",
        "allowInfluenceForcing": false,
        "influenceDelta": -1,
        "respectDelta": 1,
        "targetNode": "END"
      },
      {
        "text": "Attends. Explique comment on récupère ce qui est pris, si c'est possible.",
        "test": "Raison+Logique:8",
        "allowInfluenceForcing": true,
        "influenceDelta": 0,
        "respectDelta": 0,
        "targetNode": "END"
      },
      {
        "text": "Je change d'avis. Je renonce au raccourci.",
        "allowInfluenceForcing": false,
        "influenceDelta": -2,
        "respectDelta": -1,
        "targetNode": "END"
      }
    ]
  },
  {
    "id": "NODE_START_CHOICE_0",
    "speaker": "Voknir Esh'Maradel",
    "line": "Les mots que tu choisis sont justes, mais incomplets. \"Fréquence\" n'est pas une musique abstraite ici ; c'est la manière dont la matière même choisit de vibrer. Regarde.\" Il étire son bras à sept doigts et, d'un geste lent, racle la pierre. Une ligne s'ouvre, fine comme une cicatrice, et la lumière des torches s'y courbe. \"L'os — et je parle des os des Plis, des pierres qui ont appris à garder mémoire — résonne. Chaque passage laisse des harmoniques : des crêtes et des creux où les Textes Absolus ont été récités, où des serments ont été tatoués par la vie et la mort. Ces harmoniques ont une fréquence propre, une signature. Quand tu passes, tu ajoutes ton propre ton. Parfois tu l'accordes; parfois tu le déchires.\n\n\"Quand je dis que les Plis changent de 'fréquence', je veux dire qu'ils modulent ces harmoniques : la phase (l'endroit où commence la vague), l'amplitude (à quel point elle est violente) et la pureté (si la note est claire ou dissonante). Une note pure suit les Textes — elle glisse, calme. Une note dissonante crée des interférences : des lames qui apparaissent, des effritements de réalité. C'est ce que j'appelle être 'plus net' et 'plus cruel' : les bords de la pièce deviennent coupants parce que les ondes se heurtent et concentrent la douleur.\n\n\"Les cartes saignent la vérité parce que j'ai appris à tracer ces harmoniques. Une courbe peut te mener par une zone où les fréquences sont stables — long, sûr, mais verrouillé par les Textes. Une autre courbe te fait traverser une discordance : elle te fait gagner du temps, mais elle arrache des lambeaux de sens et peut te laisser en miettes si ta propre fréquence n'est pas compatible. Comprendre, pour moi, c'est entendre ces signatures, sentir où ta note se mêlera, où elle se cassera. Veux-tu que je te montre comment écouter ?\"",
    "consequences": {
      "flag": "A_percu_frequence",
      "description": "Le PJ a reçu une explication sur la nature des fréquences des Plis. Ouvre des options de navigation et d'expérimentation."
    },
    "choices": [
      {
        "text": "Montre‑moi — fais‑le sentir.",
        "test": "Perception+Sensation:10",
        "allowInfluenceForcing": true,
        "influenceDelta": 0,
        "targetNode": "END"
      },
      {
        "text": "Parle clair : qu'est‑ce que ça signifie pour la Vieille Ville ?",
        "allowInfluenceForcing": true,
        "influenceDelta": 0,
        "targetNode": "END"
      },
      {
        "text": "Très bien. Alors je prendrai le chemin qui respecte les Textes.",
        "allowInfluenceForcing": false,
        "respectDelta": 1,
        "targetNode": "END"
      },
      {
        "text": "Je prends le raccourci qui les contredit. Je préfère le risque.",
        "allowInfluenceForcing": false,
        "respectDelta": -1,
        "targetNode": "END"
      }
    ]
  }
]